 index,budget,keywords,original_language,title,popularity,release_date,revenue,runtime,vote_average,vote_count,genre,release_year,release_month,release_day,first_actor,first_actor_gender,director_first_name,director_gender
2710,0,whiskey experimental film wallet cult director,fr,Wild Grass,1.866443,2009-05-20,0,104,5.8,22,Drama,2009,5,20,Andr\u00e9 Dussollier,NA,Alain,male
1551,3.7e+07,heir to the throne grandmother granddaughter relationship high school princess royalty,en,The Princess Diaries,40.176265,2001-08-03,165335153,115,6.5,1023,Comedy,2001,8,3,Anne Hathaway,female,Garry,male
486,9e+07,new york witch uprising witch hunter,en,The Last Witch Hunter,52.612025,2015-10-21,146936910,106,5.7,1316,Action,2015,10,21,Vin Diesel,male,Breck,male
2947,1e+07,miracle jesus christ last supper bible christian,en,The Visual Bible: The Gospel of John,3.208172,2003-09-11,4069090,125,8.2,12,Drama,2003,9,11,Christopher Plummer,male,Philip,male
4443,850000,gay coming out religion mormon,en,Latter Days,5.424916,2003-07-10,819939,107,6.7,56,Drama,2003,7,10,Steve Sandvoss,male,C.,NA
1384,3.5e+07,funeral friends hospital aftercreditsstinger duringcreditsstinger,en,Friends with Benefits,40.526587,2011-07-21,150483765,109,6.5,2237,Comedy,2011,7,21,Justin Timberlake,male,Will,male
2886,1.2e+07,adolescence loss of father lion south africa bullying,en,Duma,4.795244,2005-04-22,0,100,6.9,41,Drama,2005,4,22,Alex Michaeletos,male,Carroll,male
1904,2.5e+07,gay parents kids relationship custody battle flush yoga,en,The Next Best Thing,3.707511,2000-03-03,24362772,108,4.3,29,Comedy,2000,3,3,Madonna Rupert,female,John,male
157,1.4e+08,moses bible ancient egypt 3d ramses,en,Exodus: Gods and Kings,101.599427,2014-12-03,268031828,150,5.6,1921,Drama,2014,12,3,Christian Bale,male,Ridley,male
2847,1.2e+07,friendship high school teenager classmate based on young adult novel,en,Paper Towns,64.610671,2015-06-18,85512300,109,6.1,1937,Drama,2015,6,18,Nat Wolff,male,Jake,male
585,6.6e+07,world war i horse farm life execution trapped,en,War Horse,29.505574,2011-12-25,177584879,146,7,992,Drama,2011,12,25,Tom Hiddleston,male,Steven,male
2147,2e+07,beach mossad secret agent insane asylum lye,en,The Debt,14.857884,2010-04-11,45636368,113,6.3,257,Drama,2010,4,11,Helen Mirren,female,John,male
2597,0,grifter con big con con game premarital sex,en,Confidence,9.87419,2003-04-25,0,97,6.4,126,Comedy,2003,4,25,Edward Burns,male,James,male
2867,0,NA,en,Screwed,5.359381,2000-05-12,0,81,4.9,23,Comedy,2000,5,12,Norm Macdonald,male,Scott,male
2769,1.3e+07,paris city portrait jazz subway new love,fr,"Paris, je t'aime",10.573191,2006-05-16,4857367,120,6.8,207,Drama,2006,5,16,Steve Buscemi,male,Isabel,female
1749,27500000,anti terror terror cia loss of son police brutality,en,Rendition,12.741073,2007-09-07,24748670,120,6.2,205,Drama,2007,9,7,Omar Metwally,male,Gavin,male
3922,0,independent film woman director,en,Real Women Have Curves,1.026243,2002-01-01,0,86,5.8,19,Drama,2002,1,1,America Ferrera,female,Patricia,female
3071,0,adultery restaurant textile industry male friendship bourgeoisie,it,I Am Love,5.355763,2009-09-05,0,120,6.9,73,Drama,2009,9,5,Tilda Swinton,female,Luca,male
4527,0,independent film,en,Twin Falls Idaho,0.619136,1999-07-30,0,111,7,11,Drama,1999,7,30,Mark Polish,male,Michael,male
235,97250400,competition greece colosseum olympic games emperor,fr,Asterix at the Olympic Games,20.344364,2008-01-13,132900000,116,5,471,Comedy,2008,1,13,Clovis Cornillac,male,Thomas,male
2420,0,NA,en,Lottery Ticket,9.054803,2010-08-20,0,99,5.6,54,Comedy,2010,8,20,Shad Moss,male,Erik,male
1245,4e+07,street gang uncle female assassin witness to murder,en,Colombiana,33.785969,2011-07-27,60965854,108,6.5,824,Drama,2011,7,27,Zoe Saldana,female,Olivier,male
564,7.2e+07,symbolism water farm faith alien,en,Signs,28.848187,2002-08-02,408247917,106,6.4,1599,Drama,2002,8,2,Mel Gibson,male,M.,NA
2360,1.8e+07,NA,en,Getaway,16.520516,2013-08-29,10501938,90,4.9,246,Action,2013,8,29,Ethan Hawke,male,Courtney,female
2921,1.2e+07,NA,en,Drive Hard,3.94487,2014-05-26,0,96,3.9,74,Comedy,2014,5,26,Thomas Jane,male,Brian,male
1160,4e+07,london england england 1970s spirit single mother,en,The Conjuring 2,68.794673,2016-05-13,320170008,134,7,1949,Horror,2016,5,13,Patrick Wilson,male,James,male
2610,1.6e+07,terror journalism new love sadness fbi,en,A Mighty Heart,9.717392,2007-01-01,18928871,100,6.7,95,Drama,2007,1,1,Angelina Jolie,female,Michael,male
3188,0,gay great britain narration glam rock bisexual,en,Velvet Goldmine,10.932711,1998-10-23,1053788,119,6.9,116,Drama,1998,10,23,Ewan McGregor,male,Todd,male
97,1.5e+07,monster godzilla giant monster destruction kaiju,ja,Shin Godzilla,9.476999,2016-07-29,7.7e+07,120,6.5,143,Drama,2016,7,29,Hiroki Hasegawa,male,Hideaki,NA
1578,3.7e+07,new york photographer editor-in-chief wish michael jackson,en,13 Going on 30,41.569541,2004-04-13,96455697,98,6.3,1204,Comedy,2004,4,13,Jennifer Garner,female,Gary,male
4365,0,independent film woman director,en,Walking and Talking,0.367312,1996-07-17,0,86,6.6,7,Drama,1996,7,17,Catherine Keener,female,Nicole,female
1979,2.4e+07,sport,en,Play It to the Bone,5.566203,1999-12-25,8434146,124,5.7,53,Drama,1999,12,25,Antonio Banderas,male,Ron,male
2411,1.7e+07,best man,en,The Best Man Holiday,7.210095,2013-11-15,71625195,123,6.7,110,Comedy,2013,11,15,Terrence Howard,male,Malcolm,male
2724,18339750,berlin poison dictator clerk ideology,de,Downfall,32.445895,2004-09-08,92180910,156,7.7,1037,Drama,2004,9,8,Bruno Ganz,male,Oliver,male
4626,3e+05,coming of age,en,Anderson's Cross,0.006323,2010-05-20,0,98,0,0,Drama,2010,5,20,Joanna Cassidy,female,Jerome,male
2430,1.7e+07,remake demon necronomicon duringcreditsstinger,en,Evil Dead,33.912116,2013-04-05,97542952,91,6.4,1723,Horror,2013,4,5,Jane Levy,female,Fede,NA
304,1e+08,mercenary battle ancient greece hercules warrior,en,Hercules,76.842247,2014-07-23,243400000,99,5.6,1680,Action,2014,7,23,Dwayne Johnson,male,Brett,male
2505,0,destruction of a civilization turkey,en,Ararat,1.326264,2002-05-20,0,115,5.7,16,Drama,2002,5,20,Simon Abkarian,male,Atom,male
1295,3.9e+07,biography sport,en,Against the Ropes,2.817364,2004-02-20,6614280,106,4.5,32,Drama,2004,2,20,Meg Ryan,female,Charles,male
2875,1.2e+07,love of one's life neighbor,en,Two Lovers,8.290636,2008-11-19,3148182,110,6.6,154,Drama,2008,11,19,Joaquin Phoenix,male,James,male
1666,0,casino monte carlo painting caper independent film,en,The Good Thief,2.774811,2003-04-03,0,108,6,31,Drama,2003,4,3,Nick Nolte,male,Neil,male
477,8e+07,usa president atomic bomb john f. kennedy kubakrise threat,en,Thirteen Days,18.26121,2000-12-24,34566746,145,6.9,189,Drama,2000,12,24,Kevin Costner,male,Roger,male
1818,2.2e+07,factory concentration camp hero holocaust world war ii,en,Schindler's List,104.469351,1993-11-29,321365567,195,8.3,4329,Drama,1993,11,29,Liam Neeson,male,Steven,male
1046,4.5e+07,judge professor mission of murder supreme court,en,The Pelican Brief,17.923254,1993-12-16,195268056,141,6.3,371,Drama,1993,12,16,Julia Roberts,female,Alan,male
2105,2e+07,whip kidnapping slavery plantation night shift,en,12 Years a Slave,95.9229,2013-10-18,1.87e+08,134,7.9,3674,Drama,2013,10,18,Chiwetel Ejiofor,NA,Steve,male
1732,2.8e+07,sport ice hockey,en,"Mystery, Alaska",4.436792,1999-10-01,8888143,119,6,69,Drama,1999,10,1,Russell Crowe,male,Jay,male
2143,3.5e+07,cruise pilot ghost ship,en,Ghost Ship,27.724913,2002-10-25,68349884,91,5.3,531,Thriller,2002,10,25,Gabriel Byrne,male,Steve,male
2837,1.2e+07,woman director,en,Katy Perry: Part of Me,8.410688,2012-06-28,32726956,93,6.5,85,Music,2012,6,28,Katy Perry,female,Dan,male
3636,5e+06,suicide drug dealer redemption addict existentialism,en,Light Sleeper,6.063868,1992-08-21,0,103,5.7,15,Drama,1992,8,21,Willem Dafoe,male,Paul,male
2873,1.2e+07,independent film neighbor masturbation phone sex actress,en,Girl 6,2.993939,1996-03-22,4939939,108,5.7,16,Comedy,1996,3,22,Theresa Randle,female,Spike,male
4552,5e+05,NA,en,Girls Gone Dead,1.600171,2012-03-28,0,104,3.5,14,Comedy,2012,3,28,Katie Peterson,female,Michael,male
1375,3.5e+07,hero loyalty mockery supernatural powers high school,en,Sky High,11.041659,2005-07-29,86369815,100,5.8,550,Comedy,2005,7,29,Michael Angarano,male,Mike,male
1210,4e+07,amnesia mental institution patient trust false accusations,en,Gothika,27.303608,2003-11-21,141591324,98,5.8,629,Thriller,2003,11,21,Halle Berry,female,Mathieu,male
294,1e+08,fantasy miniature people,en,Epic,36.711378,2013-05-15,268426634,102,6.4,1121,Adventure,2013,5,15,Josh Hutcherson,male,Chris,male
832,5.5e+07,jealousy beauty immortality rivalry potion,en,Death Becomes Her,29.498304,1992-07-30,149022650,104,6.3,636,Comedy,1992,7,30,Meryl Streep,female,Robert,male
1581,5.3e+07,1970s war on drugs drug addiction drug traffic drug smuggle,en,Blow,28.350529,2001-04-04,83282296,124,7.4,1317,Drama,2001,4,4,Johnny Depp,male,Ted,male
1589,3e+07,love of animals horse identity crisis farm zebra,en,Racing Stripes,8.058109,2005-01-06,93772522,102,5.1,123,Comedy,2005,1,6,Frankie Muniz,male,Frederik,male
1008,4.9e+07,artificial intelligence android robot near future robot cop,en,Chappie,116.700319,2015-03-04,104399548,120,6.6,3062,Action,2015,3,4,Sharlto Copley,NA,Neill,male
961,4e+07,hippie exotic island beach map group dynamics,en,The Beach,41.362082,2000-02-11,144056873,119,6.3,1233,Drama,2000,2,11,Leonardo DiCaprio,male,Danny,male
4380,1e+06,fantasy enemy sister high school battlefield,en,The Battle of Shaker Heights,5.20209,2003-08-22,0,79,5.6,17,Drama,2003,8,22,Shia LaBeouf,male,Kyle,male
3577,4600000,shyness beach bicycle conversation friendship,en,The Way Way Back,32.14444,2013-06-06,23198652,103,7.1,688,Drama,2013,6,6,Liam James,male,Nat,male
173,1.3e+08,penguin musical aftercreditsstinger 3d,en,Happy Feet Two,17.7735,2011-11-17,150406466,100,5.8,373,Comedy,2011,11,17,Elijah Wood,male,George,male
3926,3e+06,poetry eroticism woman director,en,Kama Sutra - A Tale of Love,3.937939,1996-09-11,4109095,117,5.7,35,Drama,1996,9,11,Indira Varma,female,Mira,female
4224,1500000,medium evil spirit house warming aftercreditsstinger,en,Insidious,58.594852,2010-09-13,97009150,103,6.8,1737,Thriller,2010,9,13,Patrick Wilson,male,James,male
2723,0,woman director,en,The Caveman's Valentine,4.722403,2001-01-19,0,105,6,27,Drama,2001,1,19,Samuel L.,male,Kasi,female
2725,12806000,brother brother relationship paraplegic intensive care ladykiller wheelchair,es,The Sea Inside,17.363739,2004-09-03,38535221,125,7.2,219,Drama,2004,9,3,Javier Bardem,male,Alejandro,male
1634,3e+07,drug abuse mexican standoff junkie prison cell snow storm,en,Assault on Precinct 13,18.706504,2005-01-19,35294470,109,6,311,Thriller,2005,1,19,Ethan Hawke,male,Jean-Fran\u00e7ois,NA
2413,2e+07,survivor violence self help guru tricycle prosthetic arm,en,Saw: The Final Chapter,36.133536,2010-10-21,136150434,90,5.8,730,Crime,2010,10,21,Tobin Bell,male,Kevin,male
4450,0,NA,en,American Hero,5.023091,2015-12-11,0,86,5,62,Comedy,2015,12,11,Stephen Dorff,male,Nick,male
1621,1.9e+07,skateboarding adoption friendship fate,en,Dumb and Dumberer: When Harry Met Lloyd,15.67747,2003-06-13,39267515,85,4.1,210,Comedy,2003,6,13,Mimi Rogers,female,Troy,male
1317,3.8e+07,sailing trip diary sailing survival coming of age,en,White Squall,10.047579,1996-02-02,10300000,129,6.3,86,Drama,1996,2,2,Jeff Bridges,male,Ridley,male
3962,3e+06,drug dealer police killer illegal drugs dealer,en,Open Road,2.680629,2013-04-12,0,85,5.2,18,Drama,2013,4,12,Camilla Belle,female,M\u00e1rcio,NA
3402,7e+06,NA,ru,The Snow Queen,5.33861,2012-10-11,12400000,76,5.1,47,Fantasy,2012,10,11,Ivan Okhlobystin,male,Vladlen,NA
1523,3.2e+07,berlin corruption nazi background love of one's life chauffeur,en,The Good German,5.347936,2006-12-08,5914908,108,5.9,86,Drama,2006,12,8,George Clooney,male,Steven,male
2770,0,sport,en,Resurrecting the Champ,4.898437,2007-06-14,0,112,5.9,60,Drama,2007,6,14,Samuel L.,male,Rod,male
4181,0,chainsaw macabre uncle nephew relationship,en,Ed and His Dead Mother,0.023436,1993-06-04,0,93,5.5,12,Comedy,1993,6,4,Eric Christmas,male,Jonathan,male
4291,1200000,shotgun based on short film sadist pistol chained,en,Saw,63.655973,2004-10-01,103911669,103,7.2,2184,Crime,2004,10,1,Cary Elwes,male,James,male
3520,3500159,london england tradition indian lead culture clash immigration,en,Bend It Like Beckham,22.054546,2002-04-11,76578641,112,6.2,578,Drama,2002,4,11,Parminder Nagra,male,Gurinder,male
1502,3.2e+07,diving u.s. navy,en,Men of Honor,24.147269,2000-09-13,48814909,129,7,544,Drama,2000,9,13,Robert De,male,George,male
3756,6e+06,sport,en,3 Strikes,1.433692,2000-03-01,9e+06,82,5.9,15,Comedy,2000,3,1,Brian Hooks,male,DJ,male
3500,0,NA,en,Lucky Break,0.669169,2001-08-24,0,107,6.5,11,Comedy,2001,8,24,James Nesbitt,male,Peter,male
4107,2e+06,1970s teenage girl older man younger woman relationship based on graphic novel teenage sexuality,en,The Diary of a Teenage Girl,18.224326,2015-08-07,1477002,98,6.8,279,Drama,2015,8,7,Bel Powley,NA,Marielle,female
4613,2e+05,usa friendship survival scar family,en,Wendy and Lucy,0.713906,2008-05-22,0,80,6.4,64,Drama,2008,5,22,Michelle Williams,female,Kelly,female
490,8e+07,dying and death time travel romance dinosaur,en,A Sound of Thunder,7.342892,2005-05-15,5989640,110,4.8,111,Thriller,2005,5,15,Heike Makatsch,female,Peter,male
968,5e+07,detective secret fbi homicide evidence,en,Murder by Numbers,16.167093,2002-04-19,56714147,120,6,268,Drama,2002,4,19,Sandra Bullock,female,Barbet,NA
3732,0,obsession love obsessive love actor,en,Love and Death on Long Island,0.933891,1997-01-01,0,93,6.9,11,Drama,1997,1,1,John Hurt,male,Richard,male
3211,7e+06,taxi country music journalist guitar bar,en,Crazy Heart,17.697042,2009-12-16,39462438,112,6.8,274,Drama,2009,12,16,Jeff Bridges,male,Scott,male
2646,1.5e+07,NA,en,Silent Trigger,2.609057,1996-06-26,76382,93,5,22,Drama,1996,6,26,Dolph Lundgren,male,Russell,male
2509,15500000,small town mutant meteor meat alien,en,Slither,17.327279,2006-03-31,0,95,6.3,317,Comedy,2006,3,31,Nathan Fillion,male,James,male
2069,2.1e+07,japan time travel ninja,en,Teenage Mutant Ninja Turtles III,10.207065,1993-03-17,4.2e+07,96,5.1,184,Comedy,1993,3,17,Paige Turco,female,Stuart,male
2716,1.4e+07,shyness based on novel unrequited love neighbor family relationships,en,Flipped,24.210698,2010-08-06,1755212,89,7.4,418,Drama,2010,8,6,Madeline Carroll,female,Rob,male
3375,7e+06,film making film producer video surveillance sport interracial marriage,en,Redbelt,5.091253,2008-04-07,0,99,6.4,76,Drama,2008,4,7,Chiwetel Ejiofor,NA,David,male
2449,16500000,bowling based on novel servant country life jane austen,en,Sense and Sensibility,20.898711,1995-12-13,1.35e+08,136,7.2,352,Drama,1995,12,13,Kate Winslet,female,Ang,male
547,8.2e+07,brothel fantasy asylum reality escape,en,Sucker Punch,39.127082,2011-03-24,89792502,110,5.9,1623,Thriller,2011,3,24,Emily Browning,female,Zack,male
1909,2.5e+07,biography based on true story gangster twins,en,Legend,32.854557,2015-09-09,42972994,131,6.7,973,Thriller,2015,9,9,Tom Hardy,male,Brian,male
3276,8e+06,suicide depression independent film coming of age teen movie,en,It's Kind of a Funny Story,13.143045,2010-07-06,6491240,101,6.9,672,Drama,2010,7,6,Keir Gilchrist,male,Ryan,male
2902,1.2e+07,ocean florida autism key yacht,en,Triangle,25.496926,2009-10-16,0,99,6.9,612,Horror,2009,10,16,Melissa George,female,Christopher,male
3373,7e+06,based on novel biography,en,The Other Side of Heaven,2.206097,2001-04-12,4720371,113,6.7,14,Drama,2001,4,12,Christopher Gorham,male,Mitch,male
2219,2.1e+07,family relationships doctor retired visit widower,en,Everybody's Fine,15.440465,2009-12-04,0,99,6.5,284,Drama,2009,12,4,Robert De,male,Kirk,male
2567,0,witch video forest horror vision,en,Book of Shadows: Blair Witch 2,3.890223,2000-10-27,0,90,4.3,212,Thriller,2000,10,27,Kim Director,female,Joe,male
1616,4.5e+07,business man master thief thief ring,en,What's the Worst That Could Happen?,7.185212,2001-05-31,0,94,5.1,66,Comedy,2001,5,31,Martin Lawrence,male,Sam,male
3081,1e+07,japan forest,en,The Forest,19.865989,2016-01-07,40055439,95,4.8,448,Thriller,2016,1,7,Natalie Dormer,female,Jason,male
3774,4e+06,christianity homophobia pastor protest christian,en,Red State,12.062371,2011-08-19,1104682,88,5.9,316,Thriller,2011,8,19,Michael Parks,male,Kevin,male
866,5.5e+07,NA,en,Bullet to the Head,22.503935,2013-01-31,9489829,92,5.2,481,Thriller,2013,1,31,Sylvester Stallone,male,Walter,male
2835,0,holiday future musical past scrooge,en,The Muppet Christmas Carol,15.085981,1992-12-10,27281507,85,7.2,212,Drama,1992,12,10,Michael Caine,male,Brian,male
4504,0,NA,en,Light from the Darkroom,0.012942,2014-01-01,0,0,0,0,NA,2014,1,1,NA,NA,NA,NA
14,2.25e+08,saving the world dc comics superhero based on comic book superhuman,en,Man of Steel,99.398009,2013-06-12,662845518,143,6.5,6359,Action,2013,6,12,Henry Cavill,male,Zack,male
200,1.25e+08,resistance post-apocalyptic dystopia war sequel,en,The Hunger Games: Mockingjay - Part 1,206.227151,2014-11-18,752100229,123,6.6,5584,Thriller,2014,11,18,Jennifer Lawrence,female,Francis,male
4477,750000,suicide attempt gun texas mass murder farm worker,en,All the Boys Love Mandy Lane,12.284939,2008-02-15,0,90,5.7,209,Thriller,2008,2,15,Amber Heard,female,Jonathan,male
4088,2700000,paris journalist dialogue talking soulmates,en,Before Sunset,14.799323,2004-02-10,15992615,80,7.6,718,Drama,2004,2,10,Ethan Hawke,male,Richard,male
1135,4.2e+07,cold war weapon arms dealer,en,Lord of War,34.828241,2005-09-16,24127895,122,7,1335,Drama,2005,9,16,Nicolas Cage,male,Andrew,male
2058,2.2e+07,prison fire manipulation seduction vegetarian,en,Stone,12.445176,2010-10-07,9479718,105,5.2,192,Drama,2010,10,7,Frances Conroy,female,John,male
757,0,women baseball pitcher home run aging,en,Trouble with the Curve,18.587114,2012-09-21,0,111,6.6,366,Drama,2012,9,21,Clint Eastwood,male,Robert,male
4134,0,female nudity horror dark comedy female homosexuality female vampire,en,Lesbian Vampire Killers,6.632891,2009-03-16,0,86,5.3,124,Comedy,2009,3,16,James Corden,male,Phil,male
2961,0,small town fishing male friendship australia marriage crisis,en,Jindabyne,8.950864,2006-07-20,0,123,5.7,25,Drama,2006,7,20,Laura Linney,female,Ray,male
453,0,robbery investigation inspector killer clouseau,en,The Pink Panther,25.450534,2006-01-18,0,93,5.6,550,Comedy,2006,1,18,Steve Martin,male,Shawn,male
4506,0,NA,en,The Maid's Room,1.501688,2014-08-08,0,98,4.8,4,Thriller,2014,8,8,Paula Garc\u00e9s,female,Michael,male
12,2e+08,witch fortune teller bondage exotic island monster,en,Pirates of the Caribbean: Dead Man's Chest,145.847379,2006-06-20,1065659812,151,7,5246,Action,2006,6,20,Johnny Depp,male,Gore,NA
1076,2.5e+07,bank mobile phone telephone weapon police,en,Cellular,24.459948,2004-09-06,56422687,94,6.1,537,Thriller,2004,9,6,Chris Evans,male,David,male
374,9e+07,brazil pet bird musical canary,en,Rio,46.200042,2011-04-03,484635760,96,6.5,2166,Comedy,2011,4,3,Jesse Eisenberg,male,Carlos,male
4118,0,NA,en,Hum To Mohabbat Karega,0.001186,2000-05-26,0,0,0,0,NA,2000,5,26,NA,NA,NA,NA
2053,2.2e+07,holiday world war i hostility singer singing,fr,Joyeux Noël,13.960945,2005-11-09,17709155,116,7.2,212,Drama,2005,11,9,Diane Kruger,female,Christian,male
534,7.5e+07,prison,en,Bandits,24.353302,2001-10-12,67631903,123,6.2,302,Comedy,2001,10,12,Bruce Willis,male,Barry,male
1240,3.5e+07,england sister sister relationship queen kingdom henry viii,en,The Other Boleyn Girl,22.939557,2008-02-28,0,115,6.4,477,Drama,2008,2,28,Natalie Portman,female,Justin,male
1180,4e+07,overweight beauty hypnosis overweight man overweight woman,en,Shallow Hal,29.854773,2001-11-01,141069860,114,5.7,731,Comedy,2001,11,1,Gwyneth Paltrow,female,Bobby,male
95,1.65e+08,saving the world artificial intelligence father son relationship single parent nasa,en,Interstellar,724.247784,2014-11-05,675120017,169,8.1,10867,Drama,2014,11,5,Matthew McConaughey,male,Christopher,male
112,1.55e+08,aristotle egypt greece persia elephant,en,Alexander,39.019229,2004-11-21,167298192,175,5.6,927,Drama,2004,11,21,Colin Farrell,male,Oliver,male
2133,2.5e+07,terror loss of mother gun morocco deaf-mute,en,Babel,25.785925,2006-09-08,135330182,143,6.9,1055,Drama,2006,9,8,Brad Pitt,male,Alejandro,male
2273,2e+07,NA,en,Hands of Stone,7.444189,2016-08-26,0,105,6.1,109,Drama,2016,8,26,Robert De,male,Jonathan,male
646,6.5e+07,age difference midlife crisis suppressed past self-awareness childhood memory,en,The Kid,18.281798,2000-07-07,69700000,104,6,238,Comedy,2000,7,7,Bruce Willis,male,Jon,male
2231,0,tv show bigfoot,en,Strange Wilderness,4.961306,2008-02-01,6575282,87,4.7,69,Comedy,2008,2,1,Steve Zahn,male,Fred,male
3718,0,NA,en,Fugly,0.371337,2014-06-13,0,134,5.3,2,Drama,2014,6,13,Jimmy Shergill,male,Kabir,male
4660,0,helping animals,en,Give Me Shelter,0.278981,2014-06-24,0,90,0,0,Documentary,2014,6,24,Katie Cleary,female,Kristin,female
4586,3.5e+07,casino hotel roommate fictitious marriage romantic comedy,da,What Happens in Vegas,38.100488,2008-05-07,1.7e+08,99,5.8,923,Comedy,2008,5,7,Ashton Kutcher,male,Tom,male
802,7e+07,deadbeat dad cheating fianc\u00e9e teacher student sex brother sister incest,en,That's My Boy,21.723897,2012-06-14,58058367,116,5.5,453,Comedy,2012,6,14,Adam Sandler,male,Sean,male
96,1.6e+08,loss of lover dream kidnapping sleep subconsciousness,en,Inception,167.58371,2010-07-14,825532764,148,8.1,13752,Thriller,2010,7,14,Leonardo DiCaprio,male,Christopher,male
3652,5e+06,NA,en,Decoys,3.05434,2004-02-27,0,95,4.7,33,Thriller,2004,2,27,Kim Poirier,female,Matthew,male
2997,1e+07,suicide england fire country house shower,en,The Boy,38.179483,2016-01-22,64188367,97,5.8,1102,Thriller,2016,1,22,Lauren Cohan,female,William,male
1302,3.8e+07,spy experiment island secret organization wretch,en,Spy Kids 2: The Island of Lost Dreams,24.085144,2002-08-07,119723358,100,5.3,521,Action,2002,8,7,Antonio Banderas,male,Robert,male
2436,0,sport,en,Bobby Jones: Stroke of Genius,2.897449,2004-04-30,0,120,5.5,19,Drama,2004,4,30,Jim Caviezel,male,Rowdy,male
2041,2.2e+07,journalist cat ransom kidnapping ancient rome,en,"Hail, Caesar!",39.006187,2016-02-05,63647656,106,5.7,1309,Drama,2016,2,5,Josh Brolin,male,Joel,male
2532,1.8e+07,depression mother daughter relationship pregnant desire chalkboard,en,Little Women,16.418639,1994-12-21,0,115,7,215,Drama,1994,12,21,Winona Ryder,female,Gillian,female
1031,3.8e+07,karaoke marriage proposal new love love of one's life kiss,en,My Best Friend's Wedding,15.401855,1997-06-19,299288605,105,6.3,584,Comedy,1997,6,19,Julia Roberts,female,P.J.,NA
3417,4e+06,slum police brutality brazilian war on drugs rio de janeiro,pt,Elite Squad,23.604936,2007-10-12,0,115,7.8,504,Drama,2007,10,12,Wagner Moura,male,Jos\u00e9,NA
2118,2e+07,deja vu dying and death time travel loss of husband car crash,en,Premonition,22.049787,2007-02-08,84146832,96,5.8,381,Drama,2007,2,8,Sandra Bullock,female,Mennan,NA
593,7e+07,adultery infidelity secret investigation friendship,en,The Dilemma,14.780634,2011-01-13,67112664,111,5.2,304,Drama,2011,1,13,Kevin James,male,Ron,male
42,2e+08,hostage college toy barbie animation,en,Toy Story 3,59.995418,2010-06-16,1066969703,103,7.6,4597,Comedy,2010,6,16,Tom Hanks,male,Lee,male
3261,0,based on novel uruguay,en,The City of Your Final Destination,1.353971,2009-03-21,0,114,5.7,9,Drama,2009,3,21,Nicholas Blandullo,male,James,male
2696,1.1e+07,places and planets space marine future cryogenics space,en,Jason X,11.220643,2001-07-24,16951798,91,4.5,291,Fiction,2001,7,24,Kane Hodder,male,James,male
1007,0,based on novel st. petersburg russia high society imperial russia tragic death,en,Anna Karenina,26.38704,2012-09-06,68929150,130,6.5,639,Drama,2012,9,6,Keira Knightley,female,Joe,male
2232,0,prostitute musical biography telephone call cigar smoking,en,Topsy-Turvy,8.628519,1999-09-03,0,160,6.7,41,Drama,1999,9,3,Allan Corduner,male,Mike,male
4793,0,confession hazing gang member latino lgbt,en,On The Downlow,0.029757,2004-04-11,0,90,6,2,Drama,2004,4,11,Tony Sancho,male,Tadeo,male
1550,3e+07,africa indigenous human animal relationship bat,en,Ace Ventura: When Nature Calls,34.391792,1995-11-10,212385533,90,6.1,1099,Comedy,1995,11,10,Jim Carrey,male,Steve,male
3003,9e+06,concert teenager one night based on young adult novel secret location,en,Nick and Norah's Infinite Playlist,20.452449,2008-10-03,32973937,89,6.4,379,Comedy,2008,10,3,Michael Cera,male,Peter,male
407,9e+07,life and death love at first sight broken engagement fireworks religion and supernatural,en,Meet Joe Black,36.069611,1998-11-12,142940100,178,6.9,1147,Drama,1998,11,12,Brad Pitt,male,Martin,male
4125,0,NA,en,The Lost Medallion: The Adventures of Billy Stone,2.952932,2013-03-01,0,97,5.6,13,Adventure,2013,3,1,William Brent,male,Bill,male
3887,4e+06,london england alcohol sex based on novel drug addiction,en,Trainspotting,63.513324,1996-02-23,16491080,93,7.8,2655,Drama,1996,2,23,Ewan McGregor,male,Danny,male
4391,0,swimming pool tea kettle conga line spit in the face convenience store robbery,en,The Perfect Host,6.507094,2010-07-01,14870,93,6.2,135,Comedy,2010,7,1,David Hyde,male,Nick,male
1575,0,texas telegram despair leaving one's family funeral,en,Hope Floats,7.922716,1998-05-29,0,114,5.8,81,Drama,1998,5,29,Sandra Bullock,female,Forest,male
1170,4e+07,venice italy gay new york lovesickness,en,The Talented Mr. Ripley,31.385257,1999-12-25,128798265,139,7,767,Drama,1999,12,25,Matt Damon,male,Anthony,male
1566,3e+07,wife husband relationship channel surfing mullet spiritual journey life changing,en,About Schmidt,19.925026,2002-12-13,105834556,125,6.7,362,Drama,2002,12,13,Jack Nicholson,male,Alexander,male
4616,0,woman director,en,Sisters in Law,0.025211,2005-09-03,0,104,7.3,2,Documentary,2005,9,3,NA,NA,Kim,female
158,1.5e+08,spacecraft teleportation space mission parachute time travel,en,Star Trek,73.616808,2009-05-06,385680446,127,7.4,4518,Action,2009,5,6,Chris Pine,male,J.J.,NA
